<!--
  Copyright (c) 2009 Shawn Singh, Mubbasir Kapadia, Petros Faloutsos, Glenn Reinman
  See license.txt for complete license.
-->

<SteerBenchTestCase xmlns="http://www.magix.ucla.edu/steerbench"
                    xmlns:xsi="http://www.w3.org/2001/XMLSchema-instance"
                    xsi:schemaLocation="http://www.magix.ucla.edu/steerbench 
                                        TestCaseSchema.xsd">

  <header>
    <version>1.0</version>
    <name>simple-obstacle-2</name>
    <worldBounds>
      <xmin>-100</xmin>
      <xmax>100</xmax>
      <ymin>0</ymin>
      <ymax>0</ymax>
      <zmin>-100</zmin>
      <zmax>100</zmax>
    </worldBounds>
  </header>

  <suggestedCameraView>
    <position> <x>0</x> <y>35</y> <z>-10</z> </position>
    <lookat> <x>0</x> <y>0</y> <z>0</z> </lookat>
    <up> <x>0</x> <y>1</y> <z>0</z> </up>
    <fovy>45</fovy>
  </suggestedCameraView>

  <obstacle>
    <xmin>-1.98</xmin>
    <xmax>-1</xmax>
    <ymin>0</ymin>
    <ymax>1</ymax>
    <zmin>-0.5</zmin>
    <zmax>0.5</zmax>
  </obstacle>

  <agent>
    <name>A</name>
    <initialConditions>
      <radius>0.5</radius>
      <position> <x>-0.7</x> <y>0</y> <z>-10</z> </position>
      <direction> <x>0</x> <y>0</y> <z>1</z> </direction>
      <speed>0</speed>
    </initialConditions>
    <goalSequence>
      <seekStaticTarget>
        <targetLocation> <x>0</x> <y>0</y> <z>10</z> </targetLocation>
        <desiredSpeed>1.3</desiredSpeed>
        <timeDuration>1000.0</timeDuration>
      </seekStaticTarget>
    </goalSequence>

  </agent>

</SteerBenchTestCase>
