<!--
  Copyright (c) 2009 Shawn Singh, Mubbasir Kapadia, Petros Faloutsos, Glenn Reinman
  See license.txt for complete license.
-->

<SteerBenchTestCase xmlns="http://www.magix.ucla.edu/steerbench"
                    xmlns:xsi="http://www.w3.org/2001/XMLSchema-instance"
                    xsi:schemaLocation="http://www.magix.ucla.edu/steerbench 
                                        TestCaseSchema.xsd">

  <header>
    <version>1.0</version>
    <name>free-tickets</name>
    <worldBounds>
      <xmin>-100</xmin>
      <xmax>100</xmax>
      <ymin>0</ymin>
      <ymax>0</ymax>
      <zmin>-100</zmin>
      <zmax>100</zmax>
    </worldBounds>
  </header>

  <suggestedCameraView>
    <position> <x>0</x> <y>250</y> <z>-200</z> </position>
    <lookat> <x>0</x> <y>0</y> <z>0</z> </lookat>
    <up> <x>0</x> <y>1</y> <z>0</z> </up>
    <fovy>45</fovy>
  </suggestedCameraView>

  <suggestedCameraView>
    <position> <x>0</x> <y>150</y> <z>-30</z> </position>
    <lookat> <x>0</x> <y>0</y> <z>0</z> </lookat>
    <up> <x>0</x> <y>1</y> <z>0</z> </up>
    <fovy>45</fovy>
  </suggestedCameraView>

  <suggestedCameraView>
    <position> <x>0</x> <y>10</y> <z>-10</z> </position>
    <lookat> <x>0</x> <y>0</y> <z>0</z> </lookat>
    <up> <x>0</x> <y>1</y> <z>0</z> </up>
    <fovy>45</fovy>
  </suggestedCameraView>

  <agentRegion>
    <numAgents>200</numAgents>
    <regionBounds>
      <xmin>-50</xmin>
      <xmax>50</xmax>
      <ymin>0</ymin>
      <ymax>0</ymax>
      <zmin>-50</zmin>
      <zmax>50</zmax>
    </regionBounds>
    <initialConditions>
      <direction> <random>true</random> </direction>
      <radius>0.5</radius>
      <speed>0</speed>
    </initialConditions>
    <goalSequence>
      <seekStaticTarget>
        <targetLocation> <x>0</x> <y>0</y> <z>0</z> </targetLocation>
        <desiredSpeed>1.3</desiredSpeed>
        <timeDuration>1000.0</timeDuration>
      </seekStaticTarget>
      <seekStaticTarget>
        <targetLocation> <random>true</random> </targetLocation>
        <desiredSpeed>1.3</desiredSpeed>
        <timeDuration>1000.0</timeDuration>
      </seekStaticTarget>
    </goalSequence>

  </agentRegion>

</SteerBenchTestCase>
